Annotation Cluster 1	Enrichment Score: 5.005529640602367
Category	Term	Count	%	PValue	Genes	List Total	Pop Hits	Pop Total	Fold Enrichment	Bonferroni	Benjamini	FDR
GOTERM_BP_DIRECT	GO:0045944~positive regulation of transcription from RNA polymerase II promoter	92	9.714889123548048	1.217005933024545E-9	MEF2B, HNF1B, ACVRL1, HNF1A, LMO4, XRCC6, PAX6, FGF10, INO80, NFKB1, PAX3, RORA, ZBTB38, CDKN2A, FLI1, OSR1, CDKN2B, PAX9, GATA3, FOXF2, IFNG, NOBOX, ALX4, NRG1, MKL1, MYC, WWOX, SSBP4, RARG, MLXIPL, ESR1, ARNTL, HMGA2, GRHL1, PROX1, NRIP1, PRKD1, HHEX, NCOA1, UHRF1, MSX1, HNF4A, ZMIZ1, VEGFA, ZFPM2, ZNF613, FGFR2, SOX4, NFKBIA, FHL5, SOX6, MEIS1, TCF7L2, PHIP, AHRR, TFDP2, BCAS3, TCF4, NFATC2, ETV5, NKX2-5, CD28, KLF5, MAFF, BMP2, LMX1B, KLF12, RFX4, KLF13, TBX5, MAML2, SMAD4, ESRRG, KLF14, PARK2, KAT5, TET2, TMPRSS6, FOXP1, RPS6KA1, ETS1, EBF1, HIF3A, IRF1, PBX1, IRF4, RBPJ, PARP1, KLF4, RERE, NFIA, ATAD2B	813	981	16792	1.9370048134732112	4.730490904658602E-6	2.3652482494807003E-6	2.254627584630242E-6
UP_KEYWORDS	Activator	62	6.546990496304119	1.80990167785074E-8	MEF2B, PPARD, HNF1B, HNF1A, XRCC6, NFKB1, RORA, ZNF638, ZBTB38, FLI1, GATA3, FOXF2, ALX4, MYC, ATF7IP, RREB1, NKX2-6, ESR1, IRF2BP2, ARNTL, TRERF1, TOX3, NRIP1, NCOA1, EYA2, RFC1, SCYL1, MED8, ZFPM2, NFE2L3, LCORL, ERBB4, ZNF367, SOX4, SOX7, SOX6, TCF7L2, MEIS1, TFDP2, TCF4, NFATC2, ZNF423, KLF5, RFX4, LMX1B, KLF13, ZNF260, MAML2, ESRRG, AFF3, TEAD1, CREB5, KAT5, POU5F1B, EBF1, IRF1, SETD7, PBX1, IRF4, RBPJ, KLF4, NFIA	887	661	20581	2.176371764280488	8.343611979766408E-6	1.3906068311309028E-6	2.5765604327876446E-5
GOTERM_MF_DIRECT	GO:0003700~transcription factor activity, sequence-specific DNA binding	83	8.764519535374868	2.1145382011515015E-7	MEF2B, HNF1B, PPARD, HNF1A, LMO4, PAX6, NFKB1, PAX3, RORA, CBFA2T3, ZBTB38, FUBP1, FLI1, PAX9, GATA3, HOXC4, FOXF2, MKL1, MYC, ELMSAN1, ZNF577, RARG, RREB1, NKX2-6, TADA2B, MLXIPL, ESR1, ZHX3, ARNTL, HNF4G, TRERF1, PROX1, UHRF1, HNF4A, GTF2I, HOXD3, NFE2L3, ZNF613, ZNF808, ZNF367, SOX4, SOX7, ZBTB16, SOX6, TCF7L2, DRAP1, TFDP2, GATAD2A, TCF4, NFATC2, TCF25, ETV5, NKX2-5, KLF5, MAFF, ERG, LMX1B, KLF12, TBX3, TBX5, ZNF260, SMAD4, ESRRG, TEAD1, CREB5, RCAN1, AFF1, PARK2, GAS7, FOXP1, POU5F1B, HOXB3, HOXB7, ETS1, IRF6, IRF1, HIVEP3, PBX1, IRF4, RBPJ, KLF4, RERE, NFIA	809	961	16881	1.8022056752275715	2.1037444145743933E-4	1.051927534864161E-4	3.338769509197981E-4
UP_KEYWORDS	Transcription regulation	150	15.839493136219641	4.0072939173652493E-7	RALY, MEF2B, FHIT, LMO4, XRCC6, BBX, CNOT1, ZNF638, RORA, CBX8, MAP3K7, CDKN2A, CDCA7, FLI1, GATA3, HOXC4, FOXF2, ZNF577, RARG, RREB1, NKX2-6, RCOR1, TADA2B, MLXIPL, ZHX3, VAX1, HNF4G, ARID1B, ARNTL, GRHL1, TOX3, TRERF1, PROX1, PRDM8, HHEX, UHRF1, MSX1, HNF4A, RFC1, SCYL1, ZNF783, HOXD3, VGLL3, NFE2L3, UNCX, ZNF613, TSHZ3, ZNF614, ERBB4, ELL, SOX4, SOX7, CHEK2, SOX6, ZNF618, FOXQ1, AHRR, DRAP1, TFDP2, CASZ1, TCF4, TCF25, ZNF423, KLF5, MAFF, RFX4, KLF12, KLF13, MAML2, SMAD4, ESRRG, TEAD1, KLF14, KAT5, FOXP1, HOXB3, HOXB7, ETS1, EBF1, HIVEP3, RBPJ, PARP1, RERE, HDAC7, KLF4, PPARD, HNF1B, HNF1A, PAX6, NFKB1, PAX3, CBFA2T3, ZBTB38, FUBP1, OSR1, PAX9, NOBOX, ALX4, MKL1, MYC, ELMSAN1, ATF7IP, KHDRBS2, TLE3, ESR1, IRF2BP2, HMGA2, NRIP1, CCND1, NCOA1, EYA2, GTF2I, MED8, ZMIZ1, ZFPM2, JMJD1C, CUX1, LCORL, ZBTB10, ZNF367, ZNF366, ZBTB16, TCF7L2, PRDM11, GATAD2A, BCAS3, NFATC2, ERG, LMX1B, TBX3, L3MBTL3, TBX5, ZNF260, AFF3, ILF3, CREB5, PARK2, POU5F1B, ZNF664, ATXN1, IRF6, BNC2, KDM4B, IRF1, HIF3A, SETD7, PHF21A, PBX1, IRF4, NFIA	887	2332	20581	1.492469847482504	1.8471922392848672E-4	2.6390549852650658E-5	5.704734660771926E-4
UP_KEYWORDS	Transcription	153	16.156282998944032	4.7002438113125896E-7	RALY, MEF2B, FHIT, LMO4, XRCC6, BBX, CNOT1, ZNF638, RORA, CBX8, MAP3K7, CDKN2A, CDCA7, FLI1, GATA3, HOXC4, FOXF2, ZNF577, RARG, RREB1, NKX2-6, RCOR1, TADA2B, MLXIPL, ZHX3, VAX1, HNF4G, ARID1B, ARNTL, GRHL1, TOX3, TRERF1, PROX1, PRDM8, HHEX, UHRF1, MSX1, HNF4A, RFC1, SCYL1, ZNF783, HOXD3, VGLL3, NFE2L3, UNCX, ZNF613, TSHZ3, ZNF614, ERBB4, ELL, SOX4, SOX7, CHEK2, SOX6, MEIS1, ZNF618, FOXQ1, AHRR, DRAP1, TFDP2, CASZ1, TCF4, TCF25, ZNF423, KLF5, MAFF, RFX4, KLF12, KLF13, MAML2, ESRRG, SMAD4, TEAD1, KLF14, KAT5, FOXP1, HOXB3, HOXB7, ETS1, EBF1, HIVEP3, RBPJ, PARP1, RERE, HDAC7, KLF4, PPARD, HNF1B, HNF1A, PAX6, NFKB1, PAX3, CBFA2T3, ZBTB38, FUBP1, OSR1, PAX9, NOBOX, ALX4, MKL1, MYC, ELMSAN1, ATF7IP, KHDRBS2, TLE3, ESR1, IRF2BP2, HMGA2, NRIP1, CCND1, NCOA1, EYA2, GTF2I, MED8, ZMIZ1, ZFPM2, JMJD1C, CUX1, ZNF808, LCORL, POLR2L, ZBTB10, ZNF367, ZNF366, ZBTB16, TCF7L2, PRDM11, GATAD2A, BCAS3, NFATC2, ERG, LMX1B, TBX3, L3MBTL3, TBX5, ZNF260, AFF3, ILF3, CREB5, PARK2, POU5F1B, ZNF664, ATXN1, IRF6, BNC2, KDM4B, IRF1, HIF3A, SETD7, PHF21A, PBX1, IRF4, NFIA	887	2398	20581	1.4804205496312692	2.166578169066069E-4	2.4075409138513137E-5	6.691206593578691E-4
UP_KEYWORDS	DNA-binding	132	13.938753959873285	2.2572596699428744E-6	MEF2B, RAD51B, XRCC6, BBX, INO80, RORA, ZNF638, CDKN2A, FLI1, GATA3, HOXC4, FOXF2, DNAJC1, ZNF577, RARG, RREB1, NKX2-6, MLXIPL, ZHX3, RMI2, VAX1, ARID1B, ARNTL, HNF4G, GRHL1, TOX3, TRERF1, PROX1, PRDM8, HHEX, UHRF1, MSX1, RFC1, SCYL1, HNF4A, ZNF783, HOXD3, TNFAIP3, NFE2L3, UNCX, ZNF613, TSHZ3, ZNF614, SOX4, SOX7, SOX6, MEIS1, ZNF618, FOXQ1, AHRR, DRAP1, TFDP2, CASZ1, TCF4, TCF25, NKX2-5, ZNF423, KLF5, DNMT3A, MAFF, RFX4, KLF12, KLF13, SMAD4, ESRRG, TEAD1, BRCA2, KLF14, TET2, CTC1, FOXP1, HOXB3, HOXB7, ETS1, EBF1, RBPJ, PARP1, KLF4, PPARD, HNF1B, HNF1A, PAX6, NFKB1, PAX3, ZBTB38, FUBP1, MCM8, PAX9, NOBOX, ALX4, MYC, TERT, ELMSAN1, SSBP4, LEUTX, ESR1, HMGA2, GTF2I, ZFPM2, CUX1, ZNF808, LCORL, ZBTB10, ZNF367, ZNF366, ZBTB16, TCF7L2, NFATC2, ETV5, EXO1, ERG, LMX1B, TBX3, TBX5, SETBP1, ZNF260, AFF3, TNP1, ILF3, CREB5, TNP2, POU5F1B, ZNF664, ATXN1, TOX, PRM3, IRF6, IRF1, PHF21A, PBX1, IRF4, NFIA	887	2050	20581	1.4940424010779003	0.0010400566480764928	9.459533306122037E-5	0.003213367806231826
UP_KEYWORDS	Nucleus	270	28.511087645195353	4.6985117271807376E-4	FHIT, MEF2B, RAD51B, XRCC6, LEMD2, BBX, PDLIM2, ZNF638, RORA, ANKLE1, RNF212, FLI1, CDCA7, FOXF2, PTBP2, WWOX, RARG, RREB1, NKX2-6, RCOR1, TADA2B, ZHX3, HNF4G, PROX1, TOX3, CTNNA2, PRDM8, UHRF1, DCLRE1B, MSX1, SCYL1, HNF4A, RFC1, ZNF783, FBXL4, VGLL3, PIDD1, EEFSEC, FBXL3, NEK6, UNCX, ZNF613, ZNF614, TDRD3, ERBB4, ELL, NFKBIA, AKAP13, CHEK2, ZNF618, AHRR, VRK2, DRAP1, CASZ1, TCF4, NKX2-5, TCF25, KLF5, DNMT3A, KLF12, KANSL1, KLF13, FTO, MAML2, ESRRG, SMAD4, KLF14, KDR, SYNE2, DUSP26, DCP1B, ETS1, POMP, RGS6, TNK2, RBPJ, PARP1, RERE, KLF4, POP7, ATAD2B, KCNH1, HNF1B, PPARD, HNF1A, NFKB1, ZBTB38, CCNE1, ANKRD17, MSRA, NOBOX, SIK1, MYC, ATF7IP, LEUTX, ARHGEF5, TLE3, HERC2, FMN2, CCND1, CCND3, GTF2I, CCND2, MED8, SIAH2, WDR43, LCORL, POLR2L, SLC39A11, ZBTB10, UNG, ZNF367, ZNF366, FHL5, ZBTB16, PHIP, REXO1, GATAD2A, DAZL, BCAS3, FBXW11, ETV5, APBA1, TBX3, LMX1B, RBM20, SETBP1, TBX5, ZNF260, AFF3, TNP1, ILF3, AFF1, TNP2, ZNF664, RPS6KA1, RPS6KA2, BNC2, PHF21A, PBX1, PAPOLG, SLFN14, RALY, MAU2, PRC1, RBM6, INO80, FGF13, CNOT1, CBX8, TTN, APOBEC3A, CDKN2A, HOXC4, GATA3, PRKACB, DNAJC1, ZNF577, RBFOX1, TUB, RBFOX2, STK24, MLXIPL, RMI2, VAX1, ARNTL, ARID1B, GRHL1, TRERF1, PTHLH, PNPLA7, RCL1, HHEX, HOXD3, SNTG1, NFE2L3, TNFAIP3, TSHZ3, STK11, B9D2, SOX4, SOX7, SOX6, MEIS1, FOXQ1, TRIM66, GCKR, PPP1R16B, CDYL2, OTUD7B, TFDP2, ZNF423, MAFF, RFX4, BRCA2, TEAD1, ATAD5, KAT5, CPS1, FOXP1, CTC1, HOXB3, CAMKMT, HOXB7, NXN, EBF1, HIVEP3, BABAM1, HDAC7, PAX6, PAX3, CBFA2T3, FUBP1, RANBP9, MCM8, OSR1, PAX9, PLCB1, NRG1, MKL1, ALX4, TERT, CDK14, ELMSAN1, PRKCA, ANKS1B, SSBP4, KHDRBS2, ESR1, CDK6, IRF2BP2, HMGA2, NRIP1, TUT1, NCOA1, EYA2, ZMIZ1, ZFPM2, JMJD1C, MDM4, CUX1, ZNF808, UBE3C, TCF7L2, TYMS, FIGN, PRDM11, KRT8, NFATC2, SNX20, PINX1, EXO1, ERG, L3MBTL3, CREB5, PARK2, POU5F1B, ATXN1, TOX, CLASRP, GCK, PRM3, IRF6, IRF1, KDM4B, HIF3A, SETD7, JAK2, IRF4, NFIA	887	5244	20581	1.1946589305477802	0.19479010126111485	0.007195728932917866	0.6668003027347713
GOTERM_CC_DIRECT	GO:0005634~nucleus	293	30.93980992608237	6.941652453003945E-4	FHIT, MEF2B, CYP24A1, RAD51B, XRCC6, PDLIM2, PTPN22, RORA, ZNF638, ANKLE1, RNF212, ATP2B1, MAP3K7, FLI1, CDCA7, DNAJB11, APOE, FOXF2, PTBP2, WWOX, BCL2L15, RARG, RREB1, NKX2-6, PMCH, RCOR1, ZHX3, HNF4G, PROX1, TOX3, CTNNA2, PRDM8, UHRF1, MSX1, SCYL1, RFC1, HNF4A, ZNF783, VGLL3, PIDD1, AMFR, EEFSEC, FBXL3, NEK6, UNCX, ZNF613, ZNF614, TDRD3, ERBB4, ELL, PABPC4, NFKBIA, AKAP13, PXK, ZNF618, ASB18, AHRR, VRK2, DRAP1, CASZ1, TCF4, NKX2-5, TCF25, DNMT3A, KANSL1, KLF13, FTO, MAML2, ESRRG, SMAD4, KLF14, KDR, ABCG2, SYNE2, DUSP26, DCP1B, ETS1, POMP, RGS6, TNK2, RBPJ, PARP1, C6ORF10, RERE, POP7, ATAD2B, HNF1B, PPARD, HNF1A, NFKB1, ZBTB38, CCNE1, ANKRD17, TGFA, NOBOX, SIK1, SIK2, MYC, ATF7IP, ADAM10, LEUTX, ARHGEF5, TLE3, GZMB, HERC2, CCND1, CCND3, CCND2, GTF2I, SIAH2, LCORL, POLR2L, SLC39A11, UNG, ZNF367, ZNF366, FHL5, ZBTB16, PHIP, REXO1, GATAD2A, USP37, PEX14, DAZL, BCAS3, FBXW11, ETV5, APBA1, LMX1B, TBX3, FADS1, TBX5, RBM20, SETBP1, AFF3, ILF3, TNP2, SOD3, ZNF664, RPS6KA1, RPS6KA2, BNC2, MC4R, NLRP12, PBX1, MAT2B, PAPOLG, KATNAL1, SLFN14, RALY, MAU2, GNPDA2, PRC1, RBM6, INO80, LMO7, FGF10, FGF13, CNOT1, CBX8, APOBEC3A, CDKN2A, CDKN2B, HOXC4, GATA3, DNAJC1, ZNF577, RBFOX1, TUB, RBFOX2, STK24, MLXIPL, RMI2, VAX1, ARNTL, GRHL1, TRERF1, PKIA, HHEX, HOXD3, SNTG1, NFE2L3, TNFAIP3, FGFR2, TSHZ3, STK11, B9D2, SOX4, SOX7, SOX6, MEIS1, ZMYND8, FOXQ1, PPP1R16B, DOCK1, CDYL2, TTBK1, OTUD7B, TFDP2, ZNF423, MAFF, RFX4, ARMC3, BRCA2, ATAD5, KAT5, TET2, FOXP1, CTC1, HOXB3, NREP, CAMKMT, HOXB7, NXN, EBF1, HIVEP3, BABAM1, HDAC7, PAX6, CBFA2T3, FUBP1, RANBP9, MCM8, OSR1, PAX9, PLCB1, NDUFS3, ALX4, NRG1, MKL1, TERT, TUBA1C, CDK14, ELMSAN1, PSMD9, SSBP4, NOS1AP, ESR1, NEK10, CDK6, IRF2BP2, HMGA2, PALLD, NRIP1, TUT1, PRKD1, CMSS1, NCOA1, UMPS, EYA2, ZFPM2, MDM4, JMJD1C, CUX1, ZNF808, UBE3C, GPRC5B, TCF7L2, MAP3K7CL, TRIB2, TRIB1, TYMS, C2ORF16, BUD13, FIGN, PRDM11, KRT8, NFATC2, SNX20, PINX1, EXO1, DLST, ERG, L3MBTL3, FLT3, CREB5, RCAN1, PARK2, GORAB, POU5F1B, ANXA2, ATXN1, NDOR1, TOX, CLASRP, PRM3, IRF6, IRF1, KDM4B, HIF3A, JAK2, IRF4, NFIA	841	5415	18224	1.1725108503156005	0.3011461516718136	0.06915521024829774	0.9993746366728895
GOTERM_MF_DIRECT	GO:0003677~DNA binding	107	11.298838437170012	0.0015705622484318545	RAD51B, XRCC6, BBX, RBM6, INO80, RORA, CDKN2A, FLI1, GATA3, FOXF2, DNAJC1, ZNF577, RARG, RCOR1, TADA2B, MLXIPL, ZHX3, RMI2, ARID1B, ARNTL, TRERF1, PROX1, PRDM8, HHEX, SCYL1, RFC1, HNF4A, ZNF783, HOXD3, TNFAIP3, UNCX, ZNF614, TSHZ3, SOX6, MEIS1, ZNF618, AHRR, DRAP1, TFDP2, OTUD7B, CASZ1, TCF4, TCF25, NKX2-5, ZNF423, DNMT3A, RFX4, KLF12, SMAD4, ESRRG, TEAD1, KLF14, TET2, HOXB3, HOXB7, ETS1, EBF1, PARP1, RBPJ, RERE, PPARD, HNF1B, HNF1A, PAX6, NFKB1, MCM8, PAX9, ALX4, MYC, TERT, ELMSAN1, KIF15, ESR1, HMGA2, GTF2I, ZFPM2, ZNF808, LCORL, POLR2L, ZBTB10, ZNF367, ZNF366, AKAP9, ZBTB16, PRDM11, NFATC2, ETV5, EXO1, ERG, TBX3, TBX5, SETBP1, ZNF260, TRIM26, TNP1, ILF3, RCAN1, TNP2, ATXN1, TOX, PRM3, IRF6, BNC2, HIF3A, IRF1, PBX1, NFIA	809	1674	16881	1.3337608712025555	0.7906897943444249	0.12219267539313394	2.451263358052591
GOTERM_CC_DIRECT	GO:0005654~nucleoplasm	157	16.578669482576558	0.004610346421795735	CYP24A1, RAD51B, MAU2, PRC1, XRCC6, BBX, ZNF638, RORA, CBX8, APOBEC3A, CDKN2A, CDCA7, CDKN2B, GATA3, COL4A3BP, GIT2, PRKACB, RBFOX2, RARG, MAGI1, RREB1, STK24, RCOR1, MLXIPL, ZHX3, RMI2, HNF4G, ARID1B, ARNTL, GRHL1, PTHLH, RCL1, MSX1, HNF4A, RFC1, HOXD3, FBXL4, PIDD1, NEK6, FGFR2, TSHZ3, ERBB4, STK11, ELL, PFKFB3, SOX4, SOX7, CHEK2, SOX6, RFFL, MTIF2, GCKR, TRIM66, DOCK1, TFDP2, CASZ1, KLF5, DNMT3A, MAFF, KANSL1, KLF12, MAML2, ESRRG, SMAD4, TEAD1, BRCA2, KAT5, FOXP1, DHFR, SYNE2, HOXB7, ETS1, POMP, BABAM1, RBPJ, PARP1, POP7, HDAC7, KLF4, PPARD, HNF1B, HELQ, HNF1A, PAX6, NFKB1, PAX3, CBFA2T3, SKAP2, FUBP1, DDI2, CCNE1, MSRA, MCM8, CASP8, MKL1, MYC, TERT, ELMSAN1, PSMD9, PRKCA, ATF7IP, KHDRBS2, ARHGEF5, TLE3, ESR1, CDK6, HERC2, HMGA2, NRIP1, CCND1, NCOA1, EYA2, CCND3, CCND2, GTF2I, MED8, ZMIZ1, ZFPM2, SIAH2, MDM4, JMJD1C, CUX1, WDR43, POLR2L, ZBTB10, UNG, ZNF367, TCF7L2, TYMS, KRT8, GATAD2A, NFATC2, ETV5, EXO1, TBX5, ZNF260, AFF3, ILF3, ITPR3, GORAB, ATXN1, GCK, RPS6KA1, RPS6KA2, AKR1B1, KDM4B, IRF1, HIF3A, SETD7, ANXA13, PHF21A, PBX1, ZC3H11A, JAK2, IRF4, PAPOLG, NFIA	841	2784	18224	1.2220194896606393	0.9078593931241725	0.19488264556073542	6.4654299473349885
GOTERM_BP_DIRECT	GO:0006351~transcription, DNA-templated	115	12.143611404435058	0.0185885596413536	RALY, FHIT, MEF2B, XRCC6, BBX, INO80, CNOT1, RORA, ZNF638, CBX8, MAP3K7, CDKN2A, CDCA7, HOXC4, ZNF577, RARG, NKX2-6, RCOR1, TADA2B, MLXIPL, ZHX3, VAX1, ARID1B, ARNTL, HNF4G, TRERF1, PROX1, TOX3, PRDM8, HHEX, UHRF1, RFC1, SCYL1, HNF4A, ZNF783, HOXD3, VGLL3, NFE2L3, UNCX, ZNF613, ZNF614, TSHZ3, ERBB4, SOX7, CHEK2, SOX6, ZNF618, FOXQ1, AHRR, DRAP1, TFDP2, CASZ1, TCF25, ZNF423, KLF12, SMAD4, ESRRG, KLF14, KAT5, FOXP1, HOXB3, HOXB7, EBF1, HDAC7, RERE, PPARD, HNF1B, PAX6, PAX3, CBFA2T3, ZBTB38, OSR1, PAX9, MKL1, ELMSAN1, ATF7IP, KHDRBS2, TLE3, ESR1, IRF2BP2, NRIP1, CCND1, NCOA1, EYA2, ZMIZ1, ZFPM2, JMJD1C, CUX1, ZNF808, ZBTB10, ZNF367, ZNF366, ZBTB16, TCF7L2, PRDM11, GATAD2A, BCAS3, ERG, LMX1B, TBX3, L3MBTL3, ZNF260, AFF3, ILF3, PARK2, POU5F1B, ZNF664, ATXN1, IRF6, BNC2, KDM4B, HIF3A, PHF21A, SETD7, NFIA	813	1955	16792	1.2149627378626728	1.0	0.5040527683281169	29.362776667506306

Annotation Cluster 2	Enrichment Score: 4.9466165970319835
Category	Term	Count	%	PValue	Genes	List Total	Pop Hits	Pop Total	Fold Enrichment	Bonferroni	Benjamini	FDR
UP_SEQ_FEATURE	signal peptide	204	21.541710665258712	2.5677560473600026E-7	CADM2, EFNA1, GRIN3B, DNAJB11, LILRA3, APOE, LCAT, FSTL5, IFNG, CFH, CHRNA5, APOH, IGLL1, GRID1, PTPRM, PMCH, PTPRT, PTPRO, TMEM132E, ADAMTS7, CCR7, VSIG2, ADAMTS8, HEPACAM, VEGFA, TFPI, EFNA5, AMFR, CD226, GLG1, HLA-DRB1, ERBB4, HFE, FAM19A2, KLKB1, BMP2, IL23R, IL1RL1, TGFBR2, IL1RN, PCDH15, CELSR2, GAS1, SLAMF7, EPHA2, KDR, SEMA6D, CHRNB4, PAPPA2, IL5RA, CD200, ACVRL1, FAM3D, LDLR, NPNT, CDSN, TMEM108, SLC24A3, CREG1, DPEP3, TGFA, HHIP, FGF3, ADAM10, EGFL6, SDK1, GZMB, IL6R, MMP15, SLIT2, SLIT3, INHBB, GRM4, GIPR, PSG4, GRM6, CPXM1, NPPB, IL12B, SEMA4D, CHL1, SEMA4A, HLA-DQB1, C7, DHH, PARD3, CXCL5, C3, CXCL6, NPDC1, LRRTM4, FAT3, FAT4, LRRTM1, PCSK9, DEFB116, CD28, FLRT2, LRRN2, FZD7, SOD3, CLEC11A, SOST, LAYN, FBLN5, MICB, GRIK1, FGF10, VTN, AADACL2, WNT4, GP6, LPA, ROBO1, APOA5, UNC5C, PDGFD, DNAJC1, PTPRN2, HLA-C, HLA-B, FGF21, TCN2, PTHLH, IGSF1, LSAMP, CD300LF, COL1A1, FGFR2, ITGAL, APOC1, LRIG1, ASTN2, FGG, KDELC2, GALC, EGF, ANGPTL4, MRC1, ADAM29, ADAM23, EFEMP1, NTN4, NTN1, FURIN, ADAM21, NXPH4, CRP, LGR6, SPINT3, EMID1, AOAH, RSPO3, ITIH4, CNTNAP1, LOXL1, PILRB, KNG1, FAM24B, PCDH9, PCDH7, NRXN1, WLS, CD83, CD80, SIGLEC5, CNTN2, DCC, CPM, CD244, ADPGK, ADAMTS15, SPOCK1, CDH1, CDH2, GPRC5B, CDH4, CPZ, LINGO2, IGF1R, UGT1A6, C1QTNF5, C1QTNF6, KIAA0408, ACAN, FBN3, COL4A4, PTPRC, PTPRD, COL4A1, SVEP1, RNASE4, FLT3, FBN1, NFASC, C4BPA, ADIPOQ, HPR, NCSTN, LEP, BMPER, SUMF1, NTM, IGFBP5	877	3346	20063	1.3947632974173623	8.29298027716252E-4	2.7650912615517775E-4	4.6618727489455836E-4
UP_KEYWORDS	Disulfide bond	203	21.43611404435058	1.0004194614518774E-6	ATP1B3, CADM2, EFNA1, PTPN22, SYT9, SYT6, OR4D2, DNAJB11, LILRA3, LCAT, FSTL5, CFH, CHRNA5, APOH, IGLL1, ERAP1, HCAR3, PTPRM, PMCH, HTR4, COLEC12, PTPRT, ADAMTS7, CCR7, VSIG2, EIF2AK1, ADAMTS8, HEPACAM, VEGFA, TFPI, EFNA5, CD226, HLA-DRB1, ERBB4, ENPP1, GSDMB, HFE, KLKB1, BMP2, IL1RL1, TGFBR2, IL1RN, PCDH15, CELSR2, SLAMF7, EPHA2, ABCG2, KDR, CD207, SEMA6D, CHRNB4, PAPPA2, IL5RA, CD200, ACVRL1, FAM3D, LDLR, NPNT, NMUR2, MAPT, DPEP3, TGFA, HHIP, ADAM10, EGFL6, SDK1, GZMB, IL6R, MMP15, SLIT2, SLIT3, INHBB, GRM4, GIPR, PSG4, GRM6, CPXM1, NPPB, IL12B, TNFSF12-TNFSF13, SEMA4D, CHL1, SEMA4A, HLA-DQB1, C7, CXCL5, FUT8, C3, NPY2R, CXCL6, FAT3, FAT4, OR5B12, SLC4A7, PCSK9, DEFB116, NPFFR1, C1GALT1, CD28, FLRT2, LRRN2, TMPRSS6, FZD7, SOD3, CLEC11A, SOST, LAYN, FBLN5, MC4R, MICB, MICA, VTN, TTN, ST3GAL1, AADACL2, WNT4, GP6, LPA, ROBO1, UNC5C, PDGFD, ASPH, RGR, HLA-C, HLA-B, TCN2, IGSF1, LSAMP, CD300LF, COL1A1, KALRN, FGFR2, SLC38A4, ITGAL, LRIG1, ABCA1, ASTN2, FGG, GALC, EGF, ANGPTL4, MRC1, ADAM29, ADAM23, TNFRSF13B, EFEMP1, NTN4, NTN1, FURIN, ST8SIA4, MTNR1B, ADAM21, CACNA1D, CRP, LGR6, SPINT3, CXCR5, EMID1, AOAH, RSPO3, ITIH4, CNTNAP1, NRG1, LOXL1, KNG1, BTNL2, NRXN1, PALLD, CD83, CD80, SIGLEC5, CNTN2, CUX1, DCC, GALNT2, CPM, CD244, ADAMTS15, SPOCK1, CDH1, CPZ, LINGO2, IGF1R, ACAN, FBN3, COL4A4, PTPRD, COL4A1, SVEP1, RNASE4, FLT3, FBN1, NFASC, OR9G1, C4BPA, ADIPOQ, HPR, LEP, SLCO1B1, SUMF1, OR8H2, NTM, IGFBP5	887	3434	20581	1.37163513088493	4.610872690203882E-4	4.611829676293144E-5	0.0014241792702041067
UP_SEQ_FEATURE	disulfide bond	177	18.690601900739175	2.992870198748389E-6	MICB, ATP1B3, EFNA1, CADM2, VTN, TTN, ST3GAL1, AADACL2, OR4D2, GP6, LPA, LILRA3, ROBO1, LCAT, FSTL5, CFH, CHRNA5, APOH, IGLL1, UNC5C, PDGFD, HCAR3, RGR, PTPRM, PMCH, HTR4, HLA-C, COLEC12, PTPRT, HLA-B, TCN2, ADAMTS7, VSIG2, CCR7, ADAMTS8, HEPACAM, IGSF1, LSAMP, VEGFA, TFPI, CD300LF, EFNA5, COL1A1, CD226, KALRN, FGFR2, ITGAL, HLA-DRB1, ENPP1, ERBB4, HFE, LRIG1, ASTN2, ABCA1, FGG, KLKB1, EGF, ANGPTL4, MRC1, BMP2, ADAM29, IL1RL1, ADAM23, TNFRSF13B, IL1RN, TGFBR2, EFEMP1, NTN4, CELSR2, SLAMF7, NTN1, FURIN, EPHA2, ABCG2, GNGT1, CD207, SEMA6D, ST8SIA4, MTNR1B, CHRNB4, PAPPA2, ADAM21, CD200, FAM3D, LDLR, NPNT, CRP, LGR6, SPINT3, CXCR5, RSPO3, AOAH, MAPT, NMUR2, EMID1, DPEP3, ITIH4, TGFA, CNTNAP1, HHIP, NRG1, KNG1, ADAM10, EGFL6, BTNL2, SDK1, GZMB, MMP15, NRXN1, IL6R, PALLD, SLIT2, SLIT3, INHBB, CD83, CD80, SIGLEC5, CPXM1, GIPR, PSG4, CNTN2, NPPB, IL12B, SEMA4D, TNFSF12-TNFSF13, CHL1, SEMA4A, HLA-DQB1, DCC, C7, GALNT2, CPM, CD244, CXCL5, C3, NPY2R, ADAMTS15, CDH1, SPOCK1, CXCL6, CPZ, LINGO2, IGF1R, C1QTNF5, FAT3, FAT4, OR5B12, ACAN, PCSK9, FBN3, DEFB116, NPFFR1, CD28, COL4A4, PTPRD, SVEP1, COL4A1, RNASE4, LRRN2, FBN1, NFASC, OR9G1, C4BPA, ADIPOQ, TMPRSS6, FZD7, CLEC11A, SOD3, HPR, LEP, SOST, LAYN, FBLN5, SUMF1, OR8H2, NTM, IGFBP5	877	2917	20063	1.3881395147933573	0.009623374185233291	0.002414574734142194	0.005433558449829956
UP_SEQ_FEATURE	glycosylation site:N-linked (GlcNAc...)	238	25.131995776135163	1.0397086957142396E-5	ADCY3, ATP1B3, EFNA1, ADCY8, CADM2, ADCY5, GRIN3B, KLHDC7A, OR4D2, DNAJB11, LILRA3, CLEC4F, LCAT, FSTL5, IFNG, CHRNA5, CFH, APOH, ERAP1, GRID1, PTPRM, HTR4, COLEC12, PTPRT, TMEM26, PTPRO, TMEM132E, ADAMTS7, CCR7, VSIG2, ADAMTS8, HEPACAM, VEGFA, TFPI, SLC9C1, EFNA5, AMFR, CD226, GLG1, ERBB4, HLA-DRB1, ENPP1, HFE, KLKB1, BMP2, IL23R, IL1RL1, TGFBR2, IL1RN, CELSR2, PCDH15, GAS1, SLAMF7, EPHA2, ABCG2, KDR, ABCG8, CD207, SEMA6D, WSCD2, CHRNB4, PAPPA2, IL5RA, CD200, ABO, KCNH1, ACVRL1, FAM3D, LDLR, CDSN, ASAH2, TMEM108, SLC24A3, NMUR2, CREG1, SLC22A4, DPEP3, TGFA, HHIP, FGF3, SLC22A2, ADAM10, EGFL6, SDK1, GZMB, MMP15, IL6R, SLIT2, SLIT3, INHBB, GRM4, CPXM1, GRM6, GIPR, PSG4, KCNH7, SEMA4D, TNFSF12-TNFSF13, IL12B, SEMA4A, CHL1, HLA-DQB1, DCHS2, C7, PARD3, C3, NPY2R, FUT6, FAT3, LRRTM4, FAT4, LRRTM1, KCNE1, OR5B12, SLC4A7, PCSK9, NPFFR1, CD28, FLRT2, LRRN2, TMPRSS6, FZD7, ITPR1, SOD3, SOST, ADCY9, LAYN, FBLN5, MC4R, ABCC4, PTCH1, MICB, GRIK1, SLC44A4, FGF10, TSPAN8, VTN, ST3GAL1, WNT4, GP6, LPA, ROBO1, UNC5C, PDGFD, ASPH, RGR, PTPRN2, HLA-C, HLA-B, PNPLA7, IGSF1, LSAMP, CD300LF, COL1A1, FGFR2, SLC38A4, ITGAL, LRIG1, ASTN2, ABCA1, FGG, KDELC2, GALC, EGF, ANGPTL4, MRC1, ADAM29, ADAM23, TNFRSF13B, EFEMP1, NTN4, NTN1, FURIN, ST8SIA4, MTNR1B, ADAM21, CACNA1D, NXPH4, LGR6, CXCR5, RSPO3, EMID1, AOAH, ITIH4, CNTNAP1, NRG1, SV2C, PILRB, OCA2, KNG1, BTNL2, PCDH9, NRXN1, PCDH7, CD83, FOLH1, CD80, SIGLEC5, CHST9, CNTN2, DCC, CPM, CD244, ADAMTS15, CDH1, CDH2, GPRC5B, CDH4, CPZ, LINGO2, UGT1A6, IGF1R, C1QTNF5, C1QTNF6, ACAN, FBN3, HS6ST1, SCN5A, COL4A4, PTPRC, CNNM3, PTPRD, NCEH1, COL4A1, SVEP1, FLT3, FBN1, NFASC, OR9G1, C4BPA, HPR, NCSTN, BMPER, SLCO1B1, SUMF1, SLC5A8, OR8H2, NTM	877	4234	20063	1.2859449674110164	0.03303517791651989	0.006696112969168833	0.0188747216356977
UP_KEYWORDS	Glycoprotein	250	26.399155227032733	1.0934463511382063E-5	ADCY3, ATP1B3, EFNA1, ADCY8, CADM2, ADCY5, GRIN3B, KLHDC7A, OR4D2, DNAJB11, LILRA3, CLEC4F, APOE, LCAT, FSTL5, IFNG, CHRNA5, CFH, APOH, ERAP1, GRID1, PTPRM, HTR4, PTPRT, COLEC12, TMEM26, PTPRO, TMEM132E, ADAMTS7, CCR7, VSIG2, ADAMTS8, HEPACAM, VEGFA, TFPI, SLC9C1, EFNA5, CD226, GLG1, ERBB4, HLA-DRB1, ENPP1, HFE, KLKB1, BMP2, IL23R, IL1RL1, TGFBR2, IL1RN, CELSR2, PCDH15, GAS1, SLAMF7, EPHA2, KDR, ABCG2, ABCG8, CD207, SEMA6D, WSCD2, CHRNB4, PAPPA2, IL5RA, CD200, ABO, KCNH1, ACVRL1, FAM3D, LDLR, CDSN, ASAH2, TMEM108, SLC24A3, NMUR2, MAPT, CREG1, SLC22A4, DPEP3, TGFA, HHIP, MYC, FGF3, SLC22A2, ADAM10, EGFL6, SDK1, GZMB, MMP15, IL6R, SLIT2, SLIT3, INHBB, GRM4, CPXM1, GRM6, GIPR, PSG4, KCNH7, NPPB, KIAA1217, SEMA4D, TNFSF12-TNFSF13, IL12B, SEMA4A, CHL1, HLA-DQB1, DCHS2, C7, C3, NPY2R, FUT6, FAT3, LRRTM4, FAT4, LRRTM1, KCNE1, OR5B12, SLC4A7, PCSK9, NPFFR1, CD28, FLRT2, LRRN2, TMPRSS6, ITPR1, SOD3, FZD7, CLEC11A, SOST, ADCY9, LAYN, FBLN5, MC4R, ABCC4, PTCH1, MICB, MICA, GRIK1, WFS1, SLC44A4, FGF10, TSPAN8, VTN, ST3GAL1, WNT4, GP6, LPA, ROBO1, UNC5C, ASPH, PDGFD, RGR, PTPRN2, HLA-C, HLA-B, PNPLA7, CBLN2, IGSF1, LSAMP, CD300LF, COL1A1, FGFR2, SLC38A4, ITGAL, LRIG1, ASTN2, ABCA1, FGG, KDELC2, GALC, EGF, ANGPTL4, MRC1, ADAM29, ADAM23, EFEMP1, TNFRSF13B, NTN4, TET2, CPS1, NTN1, FURIN, ST8SIA4, MTNR1B, ADAM21, CACNA1D, NXPH4, LGR6, CXCR5, RSPO3, EMID1, AOAH, ITIH4, CNTNAP1, NRG1, SV2C, PILRB, OCA2, KNG1, BTNL2, ESR1, PCDH9, NRXN1, PCDH7, CD83, FOLH1, CD80, SIGLEC5, CHST9, CNTN2, DCC, CPM, CD244, ADAMTS15, CDH1, SPOCK1, CDH2, GPRC5B, CDH4, CPZ, LINGO2, UGT1A6, IGF1R, C1QTNF6, KRT8, ACAN, FBN3, HS6ST1, SCN5A, COL4A4, PTPRC, CNNM3, PTPRD, SVEP1, NCEH1, COL4A1, FLT3, FBN1, NFASC, OR9G1, C4BPA, ADIPOQ, NCSTN, BMPER, SLCO1B1, SUMF1, SLC5A8, OR8H2, NTM, IGFBP5	887	4551	20581	1.2746061980257817	0.005028131649809309	3.599934181082176E-4	0.015565083560475923
UP_KEYWORDS	Signal	227	23.970432946145724	5.506061379734507E-5	EFNA1, CADM2, GRIN3B, DNAJB11, LILRA3, APOE, LCAT, FSTL5, IFNG, CFH, CHRNA5, APOH, IGLL1, ERAP1, GRID1, PTPRM, PMCH, PTPRT, PTPRO, TMEM132E, ADAMTS7, CCR7, VSIG2, EIF2AK1, ADAMTS8, HEPACAM, VEGFA, TFPI, EFNA5, CD226, GLG1, HLA-DRB1, ERBB4, CYP2B6, HFE, FAM19A2, RIMS1, KLKB1, BMP2, IL23R, IL1RL1, TGFBR2, IL1RN, CELSR2, PCDH15, GAS1, SLAMF7, EPHA2, KDR, SEMA6D, CHRNB4, PAPPA2, IL5RA, CD200, ABO, BCO2, ACVRL1, FAM3D, LDLR, CYP2C18, NPNT, CDSN, MCF2L, ASAH2, MSRA, TMEM108, SLC24A3, CREG1, DPEP3, TGFA, HHIP, FGF3, ADAM10, EGFL6, SDK1, GZMB, MMP15, IL6R, SLIT2, SLIT3, INHBB, GRM4, CPXM1, GRM6, GIPR, PSG4, NPPB, SEMA4D, IL12B, SEMA4A, CHL1, HLA-DQB1, C7, DHH, CXCL5, C3, CXCL6, NPDC1, FAT3, LRRTM4, FAT4, LRRTM1, PCSK9, DEFB116, CD28, FLRT2, LRRN2, FADS1, FZD7, SOD3, CLEC11A, SOST, LAYN, FBLN5, RALY, MICB, MICA, GRIK1, HBS1L, FGF10, VTN, AADACL2, WNT4, GP6, LPA, ROBO1, APOA5, UNC5C, PDGFD, DNAJC1, PTPRN2, HLA-C, FGF21, HLA-B, TCN2, PTHLH, CBLN2, IGSF1, LSAMP, CD300LF, COL1A1, FGFR2, ITGAL, SLC38A7, APOC1, LRIG1, ASTN2, FGG, KDELC2, GALC, EGF, ANKDD1A, ANGPTL4, MRC1, ADAM29, ADAM23, EFEMP1, NTN4, NTN1, FURIN, CTC1, ST8SIA4, ADAM21, CACNA1D, NXPH4, CRP, LGR6, SPINT3, EMID1, AOAH, RSPO3, ITIH4, CNTNAP1, NRG1, NDUFS3, LOXL1, TERT, PILRB, KNG1, PIGZ, FAM24B, PCDH9, PCDH7, NRXN1, WLS, CD83, CD80, SIGLEC5, CNTN2, C7ORF73, DCC, CPM, CD244, ADPGK, ADAMTS15, CDH1, SPOCK1, CDH2, GPRC5B, CDH4, CPZ, LINGO2, UGT1A6, IGF1R, C1QTNF5, C1QTNF6, ACAN, FBN3, COL4A4, PTPRC, PTPRD, COL4A1, SVEP1, RNASE4, FLT3, FBN1, NFASC, C4BPA, ADIPOQ, GORAB, HPR, NCSTN, LEP, BMPER, SUMF1, NTM, IGFBP5	887	4160	20581	1.2661214877287312	0.025064185844270503	0.0012683770183637977	0.07835526917655544
UP_KEYWORDS	Secreted	109	11.510031678986273	0.004912582335400646	EFNA1, FGF10, VTN, ST3GAL1, AADACL2, WNT4, LILRA3, APOE, LCAT, IFNG, FSTL5, APOA5, APOH, CFH, IGLL1, PDGFD, TUB, PMCH, HLA-C, FGF21, TCN2, ADAMTS7, PTHLH, CBLN2, ADAMTS8, IGSF1, VEGFA, TFPI, COL1A1, FGFR2, ENPP1, APOC1, FGG, KLKB1, ANGPTL4, BMP2, ADAM23, IL1RL1, EFEMP1, IL1RN, NTN4, PCDH15, NTN1, KDR, PAPPA2, ABO, NXPH4, FAM3D, NPNT, CRP, CDSN, SPINT3, EMID1, AOAH, RSPO3, CREG1, ITIH4, TGFA, HHIP, NRG1, LOXL1, FGF3, KNG1, FAM24B, EGFL6, IL6R, SLIT2, SLIT3, INHBB, CHST9, PSG4, CPXM1, NPPB, IL12B, TNFSF12-TNFSF13, CHL1, C7, DHH, GALNT2, CXCL5, ADPGK, C3, ADAMTS15, SPOCK1, CXCL6, CPZ, C1QTNF5, C1QTNF6, ACAN, PCSK9, FBN3, DEFB116, COL4A4, FLRT2, COL4A1, SVEP1, RNASE4, FBN1, C4BPA, ADIPOQ, SOD3, CLEC11A, HPR, ANXA2, LEP, BMPER, SOST, FBLN5, IGFBP5	887	1965	20581	1.2870837170208067	0.8967168988320996	0.05386755993518921	6.77063632634487

Annotation Cluster 3	Enrichment Score: 3.760774487554795
Category	Term	Count	%	PValue	Genes	List Total	Pop Hits	Pop Total	Fold Enrichment	Bonferroni	Benjamini	FDR
GOTERM_MF_DIRECT	GO:0001077~transcriptional activator activity, RNA polymerase II core promoter proximal region sequence-specific binding	29	3.062302006335797	9.022060124405728E-6	MEF2B, HNF1A, PAX6, SOX4, MEIS1, FLI1, GATA3, NOBOX, TCF4, NFATC2, MYC, NKX2-5, KLF5, SSBP4, RFX4, KLF13, SMAD4, ESR1, TEAD1, GRHL1, HMGA2, HNF4A, EBF1, IRF1, PBX1, IRF4, RBPJ, NFIA, KLF4	809	236	16881	2.5641040413986715	0.008936817442129263	0.002241731139093206	0.014244536583940537
GOTERM_BP_DIRECT	GO:0006366~transcription from RNA polymerase II promoter	46	4.857444561774024	8.560464114839406E-5	MEF2B, HNF1A, LCORL, POLR2L, ELL, LMO4, PAX6, SOX4, NFKB1, PAX3, MEIS1, FUBP1, FLI1, PAX9, GATA3, FOXF2, NOBOX, NFATC2, ALX4, ETV5, MYC, NKX2-5, KLF5, MAFF, SSBP4, RFX4, RREB1, KLF13, ESR1, SMAD4, CREB5, GRHL1, HMGA2, MSX1, GTF2I, ETS1, EBF1, HIVEP3, IRF1, HIF3A, PBX1, IRF4, NFE2L3, PARP1, KLF4, NFIA	813	513	16792	1.8520484620050879	0.28305738985516404	0.02979788393361471	0.15847241505932974
